{
  "workflowName": "Prepare a weekly lecture",
  "userRole": "University professor",
  "objective": "Create a clear 90-minute lecture for first-year students",
  "trigger": "The previous class ends",
  "frequency": "Weekly",
  "currentTimeMinutes": 240,
  "tools": ["Google Drive", "PowerPoint", "ChatGPT"],
  "inputs": ["Course syllabus", "Previous slides", "Textbook chapter", "Reference material"],
  "desiredOutputs": ["Lecture brief", "Slide plan", "Class activity", "Final teaching package"],
  "currentSteps": [
    {
      "id": "l1",
      "order": 1,
      "description": "Search old folders and gather source materials",
      "tool": "Google Drive",
      "inputs": ["Previous slides", "References"],
      "output": "Source collection",
      "estimatedMinutes": 35,
      "painPoints": ["Files are stored inconsistently"],
      "decisionsRequired": [],
      "repeated": true,
      "humanReviewMandatory": false
    },
    {
      "id": "l2",
      "order": 2,
      "description": "Review the syllabus and define learning objectives",
      "tool": "Documents",
      "inputs": ["Course syllabus"],
      "output": "Learning objectives",
      "estimatedMinutes": 25,
      "painPoints": ["Objectives are rewritten each week"],
      "decisionsRequired": ["Appropriate scope for students"],
      "repeated": true,
      "humanReviewMandatory": true
    },
    {
      "id": "l3",
      "order": 3,
      "description": "Recreate a lecture outline from source material",
      "tool": "Documents",
      "inputs": ["Source collection", "Learning objectives"],
      "output": "Lecture outline",
      "estimatedMinutes": 55,
      "painPoints": ["Structure is rebuilt from scratch"],
      "decisionsRequired": ["Teaching sequence"],
      "repeated": true,
      "humanReviewMandatory": true
    },
    {
      "id": "l4",
      "order": 4,
      "description": "Draft slides and speaker notes",
      "tool": "PowerPoint",
      "inputs": ["Lecture outline"],
      "output": "Slide deck draft",
      "estimatedMinutes": 70,
      "painPoints": ["Formatting and repeated writing"],
      "decisionsRequired": ["Emphasis and examples"],
      "repeated": true,
      "humanReviewMandatory": true
    },
    {
      "id": "l5",
      "order": 5,
      "description": "Create a class activity",
      "tool": "Documents",
      "inputs": ["Learning objectives"],
      "output": "Class activity",
      "estimatedMinutes": 25,
      "painPoints": ["Hard to vary activities"],
      "decisionsRequired": ["Suitability for student level"],
      "repeated": true,
      "humanReviewMandatory": true
    },
    {
      "id": "l6",
      "order": 6,
      "description": "Review academic accuracy and teaching quality",
      "tool": "PowerPoint",
      "inputs": ["Slide deck draft", "Class activity"],
      "output": "Approved teaching package",
      "estimatedMinutes": 30,
      "painPoints": ["Review criteria are inconsistent"],
      "decisionsRequired": ["Academic accuracy", "Teaching quality"],
      "repeated": true,
      "humanReviewMandatory": true
    }
  ],
  "majorFrustrations": ["Rebuilding similar material", "Finding prior resources", "Inconsistent final review"],
  "repeatedActions": ["Searching folders", "Reformatting slides", "Writing lesson structures"],
  "humanJudgmentRequired": ["Academic accuracy", "Teaching decisions", "Student-level fit"],
  "sensitiveInformation": "Do not include student records or identifiable student work in external AI tools.",
  "successDefinition": "Prepare the lecture in under two hours without reducing quality",
  "desiredImprovement": "A repeatable preparation sequence with reusable templates and explicit review points"
}
